title,body
australia fights highly destructive termite aided climate change - washington post,"sign tennant creek, australia — forgotten restaurant gas station country’s red center, metal plastic parts remain unscathed. chris cook grabs timber door frame, crumples like paper hand. “this collapsed,” says cook, manager territory pest control australia’s northern territory. eyes boards hanging ragged pieces ceiling. visited abandoned building years ago, thousands uninvited guests busy. destruction galaxy auditorium restaurant wycliffe — tiny highway stop calling “ufo capital australia” — destruction lie ahead places continent mastotermes darwiniensis stopped. termites survivors ancestral species shared space dinosaurs 150 million years ago. they’re voracious relentless. climate change, they, like fellow kin, expanding range. study conducted continents published science september revealed termites love warming planet. “the extreme response surprising,” said amy zanne, professor tropical ecology university miami study’s lead author. corralled 100 scientists place blocks wood 133 sites world measure speed eaten different climates. “we ran numbers again,” said. termites crazy heat, study confirmed quantified. 10-degree celsius (18-degree fahrenheit) increase temperature, “wood discovery consumption” increased sevenfold. australian species primitive termites, closest root evolutionary tree. called “mastos” giant northern termites, breeding superpower: member colony transform breeding queen previous monarch felled. that, broad palate known eat lead, plastic, leather, ivory asphalt. cook treated colony took concrete building’s water pipes climbed stories. species long infuriating life tropical north australia, place found. past decades, started establishing farther south. cook spends days driving thousands miles scorching northern territory. tennant creek — 10 hours darwin, territory’s capital closest city — small community he’s testing termites blocked contained bait. greatest worry impact main town australia’s huge isolated outback: alice springs, population 25,000, directly line apparent advance. “it’s matter when, if,” cook said prospect. “they’re going here, they’re going cause lot problems.” theo evans, biologist university western australia specializes termites, said giant northern termite appeared 20 years ago town ti tree, 800 miles south darwin. it’s common pest there, chomping structures hollowing local palm trees, particularly favorite meal. pest control business treated damage hours south, including remote indigenous community papunya, discovered school attack. temperature extremes protected arid parts australia date. country’s tropical zones, weather reliably balmy, giant northern’s gluttonous garrisons plentiful. like reptiles, termites generate body heat absorb environment. tropics, temperature drops 68 degrees, “these termites barely walk,” evans said. “it’s funny see.” frosty winter nights alice springs decreasing, though. mean temperatures increased 1 degree c (1.8 degrees f) 1910, number days 40 degrees c (104 degrees f) annually doubled 1950. cook roamed tennant creek, checking group buildings tourist attraction touting region’s gold-mining past. later place bait stations intended attract termites, containing new pesticide intended kill insects inadvertently transport colonies. bait far proved effective mastos. “if product works … we’ll ready hit alice springs,” said. australia far place worsening termite woes — extraordinary cost — likely world grows hotter. “people chicago, issues termites — zero, — start getting kinds problems people south have,” evans said. “and people toronto basically don’t problems termites all, start getting sorts issues chicago has.” modeling 2017 scientists purdue university university lausanne concluded 12 world’s 13 invasive termite species increase significantly distribution 2050 given earth’s current temperature trajectories. possible incursion zones extend canada patagonia, finland iran, new zealand namibia — greenland. meanwhile, invasive varieties florida demonstrated possible threat species’ habitats begin overlap: hybridization new “highly destructive super-termites.” coptotermes formosanus coptotermes gestroi shown tendency interbreeding warm winters, university florida scientists discovered 2015. young grow twice fast parents did. termites cause billions dollars damage globally year. play outsize role carbon cycle. “basically, they’re like little cows, burping they’re farting methane,” zanne said. creatures’ guts evolved perfect home microbes break cellulose, plant cell wall, nutrients discard methane gas waste digestive process. 20 million tons methane released annually, ground atmosphere, end termites. still, added, “if didn’t things like termites microbes decompose things, we’d walking pile dead animals plants. happens perturb system things like warming planet?” alex cheesman, soil scientist james cook university contributed science study, said increase termite populations create worrisome climate feedback loop. “you increased climate change result climate changes, it’s problematic,” said. hotter world becomes, termites thrive. termites thrive, methane released atmosphere. methane, hotter climate becomes. driving hours tennant creek base alice springs baking-hot december morning, cook looked tad sheepish discussing greenhouse gasses affect pest control industry. 2022, time recorded history, southern australia faced outbreak deadly tropical illness japanese encephalitis mosquitoes proliferated flooding scientists said exacerbated warmer air. united states, lyme disease continues spread ticks carry warming temperatures new areas. united kingdom, destructive aphids feeding plant species spring heat prompts lay eggs earlier. “climate change good industry,” said cook, despite personal worries planet. “there’s cockroaches, mice, everything.”"
‘biofoul’ hull strands cruise ship sea 6 days - new york times,enable js disable ad blocker
"texas couple stranded cruise passengers onboard ship near australia, son says - wfaa.com",reference #18.6dff0117.1672766555.312ed73e
new year cruise stranded australia hull ‘marine growth’ - al jazeera english,"passengers stranded board week divers remove ‘biofoul’ – accumulation microorganisms, plants, algae small animals. passengers luxury new year’s cruise new zealand australia reportedly stranded board week “marine growth” ship’s hull. divers remove “biofoul” – accumulation microorganisms, plants, algae small animals – 930-berth viking orion anchored international waters, australian government said. cleaning required protect australia’s waters “potentially harmful marine organisms”, fisheries department said statement sent afp news agency. nine-deck viking orion, built 2018 spa, theatre, sports deck pool, left auckland december 23, according tracking website vesselfinder.com. cruise ship port calls leaving new zealand capital, wellington, december 26, tracker said, apparently missing scheduled stops christchurch, dunedin tasmanian state capital hobart. cleaned international waters south australian state capital adelaide, viking orion finally expected arrive melbourne later tuesday, company australian government said. viking confirmed remove “a limited standard marine growth” hull. “while ship needed miss stops itinerary order required cleaning conducted, expected resume current itinerary,” viking said statement sent afp. “viking working directly guests compensation impact voyage,” company said, declining details. follow al jazeera english:"
australia monitoring iranian warships transiting south pacific global force - abc news,"australia monitoring iranian warships transiting south pacific global force latest flood weather warnings, search abc emergency iranian warships tracked passing south pacific global deployment aimed demonstrating islamic republic's growing military power maritime reach. november iranian frigate, accompanied converted oil tanker, docked jakarta heading pacific, stage vessel enter australia's exclusive economic zone (eez). defence spokesperson confirmed iranian vessels monitored australia operating region. ""as australia's broader whole-of-government maritime border protection efforts, defence routinely monitors maritime traffic vicinity exclusive economic zone maritime approaches,"" spokesperson said. ""defence aware iranian warships operating indo-pacific time."" february year, chinese warships sailed past indonesia entered australia's eez arafura sea heading pacific ocean torres strait. unlike chinese vessels, aimed high-powered laser raaf surveillance plane, iranian warships headed philippine sea leaving indonesia continue eastward australian waters. ""at time iranian vessel entered australia's exclusive economic zone, transited torres strait communication them,"" defence spokesperson confirmed. christmas day, france's pacific command revealed contact iranian vessels declared intention pass remote marquesas islands. falcon 200 surveillance aircraft monitored iris dena iris makran approached french polynesia's eez. maritime analysts told abc evidence iranian warships port visits pacific, believe flotilla passed close solomon islands. forward base ship iris makran frigate iris dena form iranian navy's 86th flotilla, departed islamic republic end september historic worldwide deployment. shortly departure, iran's navy chief declared warships circumnavigate globe mission ""show authority dear people iran world"". speaking state television december, rear admiral shahram irani said important iran demonstrate growing naval capacity. ""what important matter maritime presence authority … presence seas means power authority,"" navy chief explained. australia ramp actions iran ""egregious"" human rights abuses, including executions protesters, parliamentary inquiry told. ""the message frigate submarine sends country builds acquired required knowledge dominate sea."" navy chief revealed sailing australia lifelong ambitions. ""i interested experiencing new environments childhood, special interest sea,"" rear admiral told iran's state-owned press tv. ""my dream sail indian ocean day reach australia."" singapore-based geopolitical analyst patrick dupont said presence iranian warships australia's region surprising given recent statements tehran, expected future visits. ""it's known iran isolated underdog certainly middle east, internationally – need friends, basically,"" mr dupont told abc. australian army analyst predicted iran's ""routine acts naval diplomacy"" continue potentially annual operation. ""iran's navy certainly going continue develop. don't think they're going cut military spending, course they're going test ships,"" said. ""they want know far sail, reality, focus going persian gulf – going main effort terms strategic planning navy."" acknowledge aboriginal torres strait islander peoples australians traditional custodians lands live, learn, work. service include material agence france-presse (afp), aptn, reuters, aap, cnn bbc world service copyright reproduced. aest = australian eastern standard time 10 hours ahead gmt (greenwich mean time)"
