title,body
germany open seized russian assets ukraine's reconstruction - bloomberg,"bloomberg markets americas. live new york, focused bringing important global business breaking markets news information happens. bloomberg markets live new york, focused bringing important global business breaking markets news information happens. world confronted pandemic 2020, australia responded hard fast be, first, successful efforts combat virus. bitcoin’s 14th birthday, 1,690,706,971% gain looks kind normal jpmorgan leads canadian m&a time years ecb’s kazaks sees ‘significant’ rate hikes meetings german inflation slowed government picked gas bills recession ‘pretty likely,’ ex-new york fed chief dudley says tesla slides tech rallies session year blackstone’s breit gets $4 billion california injection electronics returns realism self-driving bubble bursts samsung veteran sounds alarm korea losing global chip war south korea plans bigger tax breaks boost chip sector mitch mcconnell reaches new milestone longest-serving senate leader santos set sworn-in amid controversy, house gop turmoil hedge fund debuts $1.8 billion biggest female-led launch inflation lets wealthy americans heirs tax-free mitchell's masterpiece: cavs star scores 71 points win no. 21 new mexico lone undefeated team purdue's loss time running afghan refugees millennials following boomers south red-letter year red metal family trips jamaica early economics lessons new boston fed president no-honking days noise barriers aim quell mumbai’s cacophony futuristic vertical farming startups struggling tech downturn uk strikes crumbling health service add headaches sunak australia pushes landmark indigenous referendum 2023 world’s largest manmade dam 1% usable water secret explains price cheapest tesla cities keeping car-free spaces child care centers new york city shutting doors jersey city got zero traffic deaths streets ftx’s collapse blurs future blockchain gaming (podcast) people walk partially destroyed town borodianka, ukraine, jan. 2. photographer: spencer platt/getty images michael nienaber kamil kowalcze subscriber benefit subscribe sign germany open billions euros frozen russian assets help ukraine rebuild long legal issues resolved allies follow suit. chancellor olaf scholz’s government supports ukraine’s demand war reparations hasn’t taken official position seizing assets russian state. issue complex parts ruling coalition ardent others, according people familiar discussions."
climate activists find way germany’s attention: stop traffic - new york times,enable js disable ad blocker
german unemployment falls december - reuters.com,"berlin, jan 3 (reuters) - german unemployment fell december, labour office figures showed tuesday, labour market overall moderately affected war ukraine year. federal labour office said number people work decreased 13,000 seasonally adjusted terms 2.52 million. analysts polled reuters expected figure rise 15,000. seasonally adjusted jobless rate remained stable 5.5%. ""in past year, consequences russian war ukraine - price increases, uncertainties, migration refugees - left mark. view extent burdens, however, moderate,"" said labour office head andrea nahles. standards: thomson reuters trust principles. canadian manufacturing activity contracted slightly faster rate december uncertain economic outlook high inflation undercut demand, recent trend easing cost pressures reversed, data showed tuesday. reuters, news media division thomson reuters, world’s largest multimedia news provider, reaching billions people worldwide day. reuters provides business, financial, national international news professionals desktop terminals, world's media organizations, industry events directly consumers. build strongest argument relying authoritative content, attorney-editor expertise, industry defining technology. comprehensive solution manage complex ever-expanding tax compliance needs. industry leader online information tax, accounting finance professionals. access unmatched financial data, news content highly-customised workflow experience desktop, web mobile. browse unrivalled portfolio real-time historical market data insights worldwide sources experts. screen heightened risk individual entities globally help uncover hidden risks business relationships human networks. quotes delayed minimum 15 minutes. complete list exchanges delays. © 2022 reuters. rights reserved"
resilient germany weathering energy crunch - financial times,"let global subject matter experts broaden perspective timely insights opinions can’t find else. 65 € month new customers cancel anytime trial trial complete digital access ft.com standard digital premium digital packages. standard digital includes access wealth global news, analysis expert opinion. premium digital includes access premier business column, lex, 15 curated newsletters covering key business themes original, in-depth reporting. comparison standard premium digital, click here. change plan roll time trial visiting “settings & account” section. nothing, auto-enrolled premium digital monthly subscription plan retain complete access 65 € month. cost savings, change plan time online “settings & account” section. you’d like retain premium access save 20%, opt pay annually end trial. opt downgrade standard digital, robust journalistic offering fulfils user’s needs. compare standard premium digital here. changes time effective end trial period, allowing retain access 4 weeks, downgrade cancel. change cancel subscription trial time online. simply log settings & account select ""cancel"" right-hand side. enjoy subscription end current billing period. support credit card, debit card paypal payments. find plan suits best. premium access businesses educational institutions. check university organisation offers ft membership read free. international edition"
germany vows crackdown brutal new year's violence - bloomberg,"bloomberg markets americas. live new york, focused bringing important global business breaking markets news information happens. bloomberg markets live new york, focused bringing important global business breaking markets news information happens. world confronted pandemic 2020, australia responded hard fast be, first, successful efforts combat virus. bitcoin’s 14th birthday, 1,690,706,971% gain looks kind normal jpmorgan leads canadian m&a time years ecb’s kazaks sees ‘significant’ rate hikes meetings german inflation slowed government picked gas bills recession ‘pretty likely,’ ex-new york fed chief dudley says tesla slides tech rallies session year blackstone’s breit gets $4 billion california injection electronics returns realism self-driving bubble bursts samsung veteran sounds alarm korea losing global chip war south korea plans bigger tax breaks boost chip sector mitch mcconnell reaches new milestone longest-serving senate leader santos set sworn-in amid controversy, house gop turmoil hedge fund debuts $1.8 billion biggest female-led launch inflation lets wealthy americans heirs tax-free mitchell's masterpiece: cavs star scores 71 points win no. 21 new mexico lone undefeated team purdue's loss time running afghan refugees millennials following boomers south red-letter year red metal family trips jamaica early economics lessons new boston fed president no-honking days noise barriers aim quell mumbai’s cacophony futuristic vertical farming startups struggling tech downturn uk strikes crumbling health service add headaches sunak australia pushes landmark indigenous referendum 2023 world’s largest manmade dam 1% usable water secret explains price cheapest tesla cities keeping car-free spaces child care centers new york city shutting doors jersey city got zero traffic deaths streets ftx’s collapse blurs future blockchain gaming (podcast) firefighters extinguish fire coach berlin jan. 1. photographer: paul zinken/picture alliance/getty images iain rogers michael nienaber subscriber benefit subscribe sign germany vowed crack people responsible violence weekend’s new year celebrations, police, paramedics firefighters targeted fireworks dozens injured. “the government, course chancellor well, condemns times massive attacks strongest possible terms,” christiane hoffmann, spokeswoman chancellor olaf scholz, said monday regular government news conference berlin."
"what's nye attacks german police, firefighters? - dw (english)","attacks police emergency service staff marred new year's celebrations germany's biggest cities, prompting calls harsher penalties video surveillance. new year's eve berlin, fire department reported 38 separate incidents, including 14 cases firetrucks supposedly ""lured ambushes"" shot fireworks pelted beer crates. level aggression emergency service staff completely unexpected, berlin fire department spokesman thomas kirstein told public radio rbb. total 15 emergency responders injured berlin, requiring hospital treatment. police department said 18 officers injured. berlin's fire department said ""shocked saddened"" incidents, left asking lies apparent increase violence emergency service staff particular target. berlin firefighters shared video footage events twitter monday. police sociologist rafael behr hamburg police academy said incidents need analyzed detail conclusions drawn. ""we don't good overview complexity circumstances surrounding violence. instead, statements police emergency services unions stakeholders violence increasing. don't know true, don't know form violence intended,"" told dw. ""it course shocking hear cases, think emergency services save lives, good, attacked way police dealing conflict situations."" 2021, federal criminal police office reported number acts violence police officers increased 689 cases 39,649 compared previous year. 2012, cases violence police officers increased total 22.5%. however, behr believes society sensitized violence, particularly police emergency service staff. said verbal abuse classified violence, previously case. ""we know deadly attacks emergency service staff police extremely rare. number severe acts violence increased. number physical assaults increased slightly, dramatically. sensitized it,"" said. number violent attacks police officers recorded annual police crime statistics, violent incidents involving members emergency services haven't well-documented. figures subsumed police forces; exact definition violence differs survey survey. thing remain constant fact majority violence perpetrated men, said alfred gebert, professor psychology sociology federal university applied administrative sciences münster. ""the respect workers uniform drastic decline, young men ages 20 29,"" gebert told dw. ""they drunk want friends, verbal abuse, think that's failure teach young people respect schools — lack consequences perpetrators."" rafael behr believes violence demonstration particular form masculinity. ""it definitely linked way young men want seen public, strength."" but, behr said, fact problem young, inebriated men means dramatized media. ""there evidence indicate continual increase violence. rather, outbreaks violence particular contexts. happens countries big events: societal norms laws broken, especially alcohol play. new year's eve particularly extreme fireworks mix too."" view video enable javascript, consider upgrading web browser supports html5 video year, authorities lifted covid pandemic ban pyrotechnics, allowing fired new year's eve time years — inevitable number violent incidents increase lockdowns. ""i don't believe groups men perpetrate violence influence society,"" said gebert. ""in fact, believe broader society finds attacks completely unacceptable like harsher penalties perpetrators."" indeed, germany's police union gewerkschaft der polizei called harsher penalties perpetrators violence emergency service staff. fire service called use body cams order able prove acts violence actually taken place. ""that appeal, gather data analyze happened exact detail — think reality lot dramatic seem,"" said behr. ""i caution falling narrative violence free rein germany."" federal interior minister nancy faeser (spd) said attack police emergency services staff ""must punished force law"". however, faeser ruled changes law, pointing fact existing regulations tightened recent years. suspects formally identified, national head german police union (dpoig) rainer wendt told focus magazine: ""the prevailing impression emergency services staff groups young men immigrant backgrounds took riots disproportionately large extent."" echoed herbert reul conservative interior minister populous state north-rhine westphalia quoted mass-circulation tabloid bild, federal health minister jens spahn center-right christian democrats (cdu), took opportunity rethink immigration policy. edited by: rina goldenberg you're here: tuesday, dw editors round happening german politics society. sign weekly email newsletter berlin briefing."
germany calls fireworks ban attacks rescue services - guardian,"chancellor condemns incidents new year’s eve firefighters police officers targeted german police firefighters’ unions called ban personal fireworks new year’s eve, chancellor, olaf scholz, condemned incidents rescue services targeted firecrackers rockets. groups inebriated individuals setting firework displays familiar sight german streets silvester (new year’s eve), shops allowed sell sparklers small rockets, fountains firecrackers days year. sale banned years avoid overburdening hospitals covid-19 pandemic, german cities year echoed bang, whizz pop consumer fireworks – causing unusually high number injuries fatalities. capital, berlin, authorities reported 33 injured police officers firefighters 1,700 missions carried evening 31 december. “what currently seeing berlin, baden-württemberg, firefighters ambushed, police officers attacked like 1 big demonstrations,” said ralf kusterer, vice-president german police union. “this new level.” police union berlin called countrywide ban sale customer fireworks. “we believe necessary large parts population light pyrotechnics new year’s eve,” spokesperson benjamin jendro told press agency dpa. germany’s union firefighters called vehicles fitted dashcams record attacks witnessed year. spokesperson scholz monday condemned “massive” assaults rescue services, berlin’s senator culture backed calls general ban. “what nonsense firecrackers for,” said klaus lederer, left party. “no needs that.” sign europe pivotal stories debates europeans – identity economics environment 17-year-old teenager died 1 january incident self-built catapult firecrackers outskirts eastern german city leipzig. man saxony-anhalt died hit car setting fireworks street."
